{
    "$schema": "http://json-schema.org/draft-07/schema",
    "required": ["name", "other-names", "first-reported", "comment"],
    "properties": {
        "name": {
            "type": "string",
            "description": "Official name of this type of malware"
        },
        "comment": {
            "type": "string",
            "description": "Information about the malware"
        },
        "other-names": {
            "type": "array",
            "items": {
                "type": "string"
            },
            "description": "Other names for this malware. After this convention is published, should not contain members unless the name is widespread and the official name disagrees"
        },
        "first-reported": {
            "type": ["null", "string"],
            "description": "The day the GitHub issue that added this was filed. Timezone is UTC, format is YY/MM/DD",
            "pattern": "^\\d\\d/(1[0-2]|0\\d)/([0-2]\\d|3[0-1])$"
        }
    }
}