{
    "$schema": "../malware-categorization.schema.json",
    "name": "Macromodules",
    "comment": "Macromodules grabber grabs Minecraft info. Generally consists of 3 classes, the Mod class, which calls the Stealer Class. The stealer class is a Gelox discord webhook class",
    "first-reported": null,
    "other-names": []
}