{
    "$schema": "../malware-categorization.schema.json",
    "name": "Kodeine",
    "comment": "Kodeine is a stealer which uses reflection to gain access to all of the session fields. Also steals Discord info. Uses a pastebin or GitHub gist to store Discord webhooks.",
    "other-names": [
        "Sir Kodeine",
        "abcd"
    ],
    "first-reported": null
}