{
    "$schema": "../malware-categorization.schema.json",
    "name": "NeoRat",
    "comment": "NeoRat grabs information from the blackboard or from the Pizza Client token, endpoint is a heroku webapp.",
    "first-reported": null,
    "other-names": [
        "Essentials",
        "Essentials.loadExtensions"
    ]
}