{
    "$schema": "../malware-categorization.schema.json",
    "name": "typetools",
    "comment": "Malware which uses several classes for payloads. Steals Discord, MC, and other pieces of information",
    "first-reported": null,
    "other-names": [
        "jodah",
        "Ben",
        "Yoink"
    ]
}