{
    "$schema": "../malware-categorization.schema.json",
    "name": "Razebator",
    "comment": "Razebator is a grabber which is often bundled with BazaarNotifier in its package, and the grabber class is normally CraftingModule. Steals Minecraft tokens",
    "other-names": [
        "TURKIE",
        "bn"
    ],
    "first-reported": null
}